symbol,name,url
ELIS,DIREXION DAILY LLY BEAR 1X SHARES,https://www.nyse.com/quote/XNMS:ELIS
ELM,ELM MARKET NAVIGATOR ETF,https://www.nyse.com/quote/ARCX:ELM
EMB,ISHARES TRUST J.P. MORGAN USD EMERGING MARKETS BD ETF,https://www.nyse.com/quote/XNMS:EMB
EMBD,GLOBAL X FDS EMERGING MKTS BD ETF,https://www.nyse.com/quote/ARCX:EMBD
EMBX,VANECK EMERGING MARKETS BOND ETF,https://www.nyse.com/quote/ARCX:EMBX
EMC,GLOBAL X FDS EMERGING MARKETS GREAT CONSUMER ETF,https://www.nyse.com/quote/ARCX:EMC
EMCB,WISDOMTREE TRUST EMERG MARKETS CORP BOND FD,https://www.nyse.com/quote/XNMS:EMCB
EMCR,DBX ETF TRUST XTRACKERS EMRG MRKTS CARBON REDUCTION AN,https://www.nyse.com/quote/ARCX:EMCR
EMCS,XTRACKERS MSCI EMERGING MARKETS CLIMATE SELECTION ETF,https://www.nyse.com/quote/ARCX:EMCS
EMDM,FIRST TRUST EXCH TRADED FUND 2 BLOOMBERG EMERGING MARKET DEMOCRACIES ET,https://www.nyse.com/quote/ARCX:EMDM
EMDV,PROSHARES TRUST MSCI EMERGING MARKETS DIVIDEND GROWERS,https://www.nyse.com/quote/BATS:EMDV
EMEQ,NOMURA FOCUSED EMERGING MARKETS EQUITY ETF,https://www.nyse.com/quote/XNMS:EMEQ
EMES,HARBOR EMERGING MARKETS SELECT ETF,https://www.nyse.com/quote/ARCX:EMES
EMGF,ISHARES INC EMERGING MARKETS EQUITY FACTOR ETF,https://www.nyse.com/quote/BATS:EMGF
EMHC,STATE STREET SPDR BLOOMBERG EMERGING MARKETS USD BOND ETF,https://www.nyse.com/quote/ARCX:EMHC
EMHY,ISHARES INC J P MORGAN EM HIGH YIELD BOND ETF,https://www.nyse.com/quote/BATS:EMHY
EMIF,ISHARES TRUST EMERGING MARKETS INFRASTRUCTURE ETF,https://www.nyse.com/quote/XNMS:EMIF
EMKT,LAZARD EMERGING MARKETS OPPORTUNITIES ETF,https://www.nyse.com/quote/ARCX:EMKT
EMLC,VANECK ETF TR VANECK J. P. MORGAN EM LOCAL CURRENCY BO,https://www.nyse.com/quote/ARCX:EMLC
EMLP,FIRST TR EXCHANGE TRADED FD IV NORTH AMERN ENERGY INFRASTR,https://www.nyse.com/quote/ARCX:EMLP
EMM,GLOBAL X FDS EMERGING MARKETS EX-CHINA ETF,https://www.nyse.com/quote/ARCX:EMM
EMMF,WISDOMTREE TRUST EMERGING MARKETS MULTIFACTOR FUND,https://www.nyse.com/quote/ARCX:EMMF
EMNT,PIMCO ETF TRUST PIMCO ENHANCED SHRT MATURITY ACTIVE ESG,https://www.nyse.com/quote/ARCX:EMNT
EMOP,AB EMERGING MARKETS OPPORTUNITIES ETF,https://www.nyse.com/quote/ARCX:EMOP
EMOT,FIRST TRUST S&P 500 ECONOMIC MOAT ETF,https://www.nyse.com/quote/ARCX:EMOT
EMPB,EFFICIENT MARKET PORTFOLIO PLUS ETF,https://www.nyse.com/quote/ARCX:EMPB
EMQQ,THE EMERGING MARKETS INTERNET ETF,https://www.nyse.com/quote/ARCX:EMQQ
EMSF,MATTHEWS INTERNATIONAL FUNDS EMERGING MARKETS SUSTAINABLE FUTURE ACTI,https://www.nyse.com/quote/ARCX:EMSF
EMTL,STATE STREET DOUBLELINE EMERGING MARKETS FIXED INCOME ETF,https://www.nyse.com/quote/BATS:EMTL
EMTY,PROSHARES TRUST DECLINE RETAIL STORE ETF,https://www.nyse.com/quote/ARCX:EMTY
EMXC,ISHARES INC MSCI EMERGING MARKETS EX CHINA USD,https://www.nyse.com/quote/XNMS:EMXC
EMXF,ISHARES TRUST ESG ADVANCED MSCI EM ETF,https://www.nyse.com/quote/XNMS:EMXF
ENDW,CAMBRIA ENDOWMENT STYLE ETF,https://www.nyse.com/quote/XNMS:ENDW
ENFR,ALPS ETF TRUST ALERIAN ENERGY INFRASTRUCTURE ETF,https://www.nyse.com/quote/ARCX:ENFR
ENHU,ISHARES ENHANCED LARGE CAP CORE ACTIVE ETF,https://www.nyse.com/quote/XNMS:ENHU
ENOR,ISHARES TRUST MSCI NORWAY ETF,https://www.nyse.com/quote/BATS:ENOR
ENPX,TRADR 2X LONG ENPH DAILY ETF,https://www.nyse.com/quote/BATS:ENPX
ENZL,ISHARES TRUST MSCI NEW ZEALAND ETF,https://www.nyse.com/quote/XNMS:ENZL
EOCT,INNOVATOR ETFS TRUST EMERGING MKTS PWR BUFFER ETF,https://www.nyse.com/quote/ARCX:EOCT
EOSU,T-REX 2X LONG EOSE DAILY TARGET ETF,https://www.nyse.com/quote/BATS:EOSU
EPAI,HARBOR AI INFLECTION STRATEGY ETF,https://www.nyse.com/quote/ARCX:EPAI
EPEM,HARBOR EMERGING MARKETS EQUITY ETF,https://www.nyse.com/quote/ARCX:EPEM
EPHE,ISHARES TRUST MSCI PHILIPPINES ETF,https://www.nyse.com/quote/ARCX:EPHE
EPI,WISDOMTREE TRUST INDIA EARNINGS USD,https://www.nyse.com/quote/ARCX:EPI
EPIN,HARBOR INTERNATIONAL EQUITY ETF,https://www.nyse.com/quote/ARCX:EPIN
EPMB,HARBOR MID CAP CORE ETF,https://www.nyse.com/quote/ARCX:EPMB
EPMV,HARBOR MID CAP VALUE ETF,https://www.nyse.com/quote/ARCX:EPMV
EPOL,ISHARES TRUST MSCI POLAND ETF,https://www.nyse.com/quote/ARCX:EPOL
EPP,ISHARES INC MSCI PACIFIC EX JAPAN ETF,https://www.nyse.com/quote/ARCX:EPP
EPRF,INNOVATOR ETFS TRUST S&P INVT GRADE PFD ETF,https://www.nyse.com/quote/BATS:EPRF
EPS,WISDOMTREE TRUST US LARGECAP FUND,https://www.nyse.com/quote/ARCX:EPS
EPSB,HARBOR SMID CAP CORE ETF,https://www.nyse.com/quote/ARCX:EPSB
EPSV,HARBOR SMID CAP VALUE ETF,https://www.nyse.com/quote/ARCX:EPSV
EPU,ISHARES TRUST MSCI PERU AND GLOBAL EXPOSURE ETF,https://www.nyse.com/quote/ARCX:EPU
EPV,PROSHARES ULTRASHORT FTSE EUROPE,https://www.nyse.com/quote/ARCX:EPV
EQAL,INVESCO EXCHANGE TRADED FD TR II RUSSELL 1000 EQL WGT ETF,https://www.nyse.com/quote/ARCX:EQAL
EQIN,COLUMBIA U.S. EQUITY INCOME ETF,https://www.nyse.com/quote/ARCX:EQIN
EQL,ALPS ETF TRUST EQUAL SECTOR WEIGHT ETF,https://www.nyse.com/quote/ARCX:EQL
EQLT,ISHARES TRUST,https://www.nyse.com/quote/XNYS:EQLT
EQRR,PROSHARES TRUST EQUITIES FOR RISING RATES ETF,https://www.nyse.com/quote/XNMS:EQRR
EQTY,VALUED ADVISERS TRUST KOVITZ CORE EQUITY ETF,https://www.nyse.com/quote/ARCX:EQTY
EQWL,INVESCO EXCHANGE TRADED FD TR S&P 100 EQUAL WEIGHT ETF,https://www.nyse.com/quote/ARCX:EQWL
ERET,ISHARES TRUST ENVIRONMENTALLY AWARE REAL ESTATE ETF,https://www.nyse.com/quote/XNMS:ERET
ERNZ,TRUESHARES ACTIVE YIELD ETF,https://www.nyse.com/quote/XNMS:ERNZ
ERTH,INVESCO EXCHANGE TRADED FD TR INVESCO MSCI SUSTAINABLE FUTURE ETF,https://www.nyse.com/quote/ARCX:ERTH
ERX,DIREXION SHARES ETF TRUST DAILY ENERGY BULL 2X SHARES,https://www.nyse.com/quote/ARCX:ERX
ERY,DIREXION SHARES ETF TRUST DAILY ENERGY BEAR 2X SHS(POST REV SPLIT),https://www.nyse.com/quote/ARCX:ERY
ESBG,FIRST TRUST ENHANCED STOCKS BONDS & GOLD ETF,https://www.nyse.com/quote/ARCX:ESBG
ESG,FLEXSHARES TRUST STOXX US ESG SELECT INDEX FUND,https://www.nyse.com/quote/BATS:ESG
ESGD,ISHARES TRUST ESG AWARE MSCI EAFE ETF,https://www.nyse.com/quote/XNMS:ESGD
ESGE,ISHARES INC,https://www.nyse.com/quote/XNAS:ESGE
ESGG,FLEXSHARES TRUST STOXX GLOBAL ESG SELECT INDEX FUND,https://www.nyse.com/quote/BATS:ESGG
ESGU,ISHARES TRUST,https://www.nyse.com/quote/XNAS:ESGU
ESGV,VANGUARD WORLD FUND ESG U.S. STOCK ETF,https://www.nyse.com/quote/BATS:ESGV
ESIM,EVENTIDE INTERNATIONAL ETF,https://www.nyse.com/quote/ARCX:ESIM
ESIX,STATE STREET SPDR S&P SMALLCAP 600 ESG ETF,https://www.nyse.com/quote/ARCX:ESIX
ESK,REX-OSPREY ETH + STAKING ETF,https://www.nyse.com/quote/BATS:ESK
ESLG,EVENTIDE LARGE CAP GROWTH ETF,https://www.nyse.com/quote/ARCX:ESLG
ESLV,EVENTIDE LARGE CAP VALUE ETF,https://www.nyse.com/quote/ARCX:ESLV
ESML,ISHARES TRUST ESG AWARE MSCI USA SMALL CAP ETF,https://www.nyse.com/quote/BATS:ESML
ESMV,ISHARES TRUST ISHARES ESG OPTIMIZED MSCI USA MIN VOL FACTOR ETF,https://www.nyse.com/quote/XNMS:ESMV
ESN,ESSENTIAL 40 STOCK ETF,https://www.nyse.com/quote/XNMS:ESN
ESPO,VANECK ETF TR VIDEO GAMING AND ESPORTS ETF,https://www.nyse.com/quote/XNMS:ESPO
ESSC,EVENTIDE SMALL CAP ETF,https://www.nyse.com/quote/ARCX:ESSC
ESUM,EVENTIDE US MARKET ETF,https://www.nyse.com/quote/ARCX:ESUM
ETCO,GRAYSCALE ETHEREUM COVERED CALL ETF,https://www.nyse.com/quote/ARCX:ETCO
ETEC,ISHARES TRUST BREAKTHROUGH ENVIRONMENTAL SOLUTIONS ETF,https://www.nyse.com/quote/XNMS:ETEC
ETFT,FUNDSMITH EQUITY ETF,https://www.nyse.com/quote/ARCX:ETFT
ETH,GRAYSCALE ETHEREUM STAKING MINI ETF,https://www.nyse.com/quote/ARCX:ETH
ETHA,ISHARES ETHEREUM TRUST ETF,https://www.nyse.com/quote/XNMS:ETHA
ETHD,PROSHARES ULTRASHORT ETHER ETF,https://www.nyse.com/quote/ARCX:ETHD
ETHE,GRAYSCALE ETHEREUM STAKING ETF,https://www.nyse.com/quote/ARCX:ETHE
ETHO,AMPLIFY ETF TRUST ETHO CLIMATE LEADERSHIP U.S. ETF,https://www.nyse.com/quote/ARCX:ETHO
ETHT,PROSHARES ULTRA ETHER ETF,https://www.nyse.com/quote/ARCX:ETHT
ETHU,2X ETHER ETF,https://www.nyse.com/quote/BATS:ETHU
ETHV,VANECK ETHEREUM ETF,https://www.nyse.com/quote/BATS:ETHV
ETHW,BITWISE ETHEREUM ETF,https://www.nyse.com/quote/ARCX:ETHW
ETQ,T-REX 2X INVERSE ETHER DAILY TARGET ETF,https://www.nyse.com/quote/BATS:ETQ
ETRL,GRANITESHARES 2X LONG ETOR DAILY ETF,https://www.nyse.com/quote/XNMS:ETRL
ETTY,AMPLIFY ETHEREUM 3% MONTHLY OPTION INCOME ETF,https://www.nyse.com/quote/BATS:ETTY
ETU,T-REX 2X LONG ETHER DAILY TARGET ETF,https://www.nyse.com/quote/BATS:ETU
EUAD,SELECT STOXX EUROPE AEROSPACE & DEFENSE ETF,https://www.nyse.com/quote/BATS:EUAD
EUDG,WISDOMTREE TRUST EUROPE QUALITY DIVID GROWTH,https://www.nyse.com/quote/ARCX:EUDG
EUDV,PROSHARES TRUST MSCI EUROPE DIVIDEND GROWERS ETF,https://www.nyse.com/quote/BATS:EUDV
EUFN,ISHARES TRUST MSCI EUROPE FINANACIALS ETF,https://www.nyse.com/quote/XNMS:EUFN
EUHY,ISHARES EURO HIGH YIELD CORPORATE BOND USD HEDGED ETF,https://www.nyse.com/quote/BATS:EUHY
EUIG,ISHARES EURO INVESTMENT GRADE CORPORATE BOND USD HEDGED ETF,https://www.nyse.com/quote/BATS:EUIG
EUM,PROSHARES SHORT MSCI EMERGING MARKETS,https://www.nyse.com/quote/ARCX:EUM
EUO,PROSHARES TRUST II PROSHARES ULTRASHORT EURO,https://www.nyse.com/quote/ARCX:EUO
EURL,DIREXION SHARES ETF TRUST DAILY FTSE EUROPE BULL 3X,https://www.nyse.com/quote/ARCX:EURL
EUSA,ISHARES INC MSCI USA EQUAL WEIGHTED ETF,https://www.nyse.com/quote/ARCX:EUSA
EUSB,ISHARES ESG ADVANCED UNIVERSAL USD BOND ETF,https://www.nyse.com/quote/ARCX:EUSB
EVHY,MORGAN STANLEY ETF TRUST EATON VANCE HIGH YIELD ETF USD,https://www.nyse.com/quote/ARCX:EVHY
EVIM,MORGAN STANLEY ETF TRUST EATON VANCE INTERMEDIATE MUNICIPAL INCOM,https://www.nyse.com/quote/ARCX:EVIM
EVLN,MORGAN STANLEY ETF TRUST EATON VANCE FLOATING RATE ETF USD,https://www.nyse.com/quote/ARCX:EVLN
EVLU,ISHARES MSCI EMERGING MARKETS VALUE FACTOR ETF,https://www.nyse.com/quote/BATS:EVLU
EVMO,EATON VANCE MORTGAGE OPPORTUNITIES ETF,https://www.nyse.com/quote/ARCX:EVMO
EVMT,INVESCO ACT MANAGE EXCH TR CMDTY FD ELEC VEH METALS COMMODIT STRA NO K-1 ETF,https://www.nyse.com/quote/XNMS:EVMT
EVNT,ALTSHARES TR EVENT-DRIVEN ETF,https://www.nyse.com/quote/ARCX:EVNT
EVSB,MORGAN STANLEY ETF TRUST EATON VANCE ULTRA-SHORT INCOME ETF USD,https://www.nyse.com/quote/ARCX:EVSB
EVSD,EATON VANCE SHORT DURATION INCOME ETF,https://www.nyse.com/quote/XNMS:EVSD
EVSM,MORGAN STANLEY ETF TRUST EATON VANCE SHORT DURATION MUNICIPAL INC,https://www.nyse.com/quote/ARCX:EVSM
EVTR,MORGAN STANLEY ETF TRUST EATON VANCE TOTAL RETURN BOND ETF USD,https://www.nyse.com/quote/XNYS:EVTR
EVUS,ISHARES TRUST ESG AWARE MSCI USA VALUE ETF,https://www.nyse.com/quote/BATS:EVUS
EVX,VANECK ETF TR VANECK ENVIRONMENTAL SERVICES ETF,https://www.nyse.com/quote/ARCX:EVX
EVYM,EATON VANCE HIGH INCOME MUNICIPAL ETF,https://www.nyse.com/quote/XNMS:EVYM
EWA,ISHARES INC MSCI AUSTRALIA ETF,https://www.nyse.com/quote/ARCX:EWA
EWC,ISHARES INC MSCI CANADA ETF,https://www.nyse.com/quote/ARCX:EWC
EWD,ISHARES INC MSCI SWEDEN ETF,https://www.nyse.com/quote/ARCX:EWD
EWG,ISHARES INC MSCI GERMANY ETF,https://www.nyse.com/quote/ARCX:EWG
EWH,ISHARES INC MSCI HONG KONG ETF,https://www.nyse.com/quote/ARCX:EWH
EWI,ISHARES INC MSCI ITALY ETF,https://www.nyse.com/quote/ARCX:EWI
EWJ,ISHARES INC MSCI JAPAN ETF NEW,https://www.nyse.com/quote/ARCX:EWJ
EWJV,ISHARES TRUST MSCI JAPAN VALUE ETF,https://www.nyse.com/quote/XNMS:EWJV
EWK,ISHARES INC MSCI BELGIUM ETF,https://www.nyse.com/quote/ARCX:EWK
EWL,ISHARES INC MSCI SWITZERLAND ETF,https://www.nyse.com/quote/ARCX:EWL
EWM,ISHARES INC MSCI MALAYSIA ETF (POST REV SPLT),https://www.nyse.com/quote/ARCX:EWM
EWN,ISHARES INC MSCI NETHERLANDS ETF,https://www.nyse.com/quote/ARCX:EWN
EWO,ISHARES INC MSCI AUSTRIA ETF,https://www.nyse.com/quote/ARCX:EWO
EWP,ISHARES INC MSCI SPAIN ETF,https://www.nyse.com/quote/ARCX:EWP
EWQ,ISHARES INC MSCI FRANCE ETF,https://www.nyse.com/quote/ARCX:EWQ
EWS,ISHARES INC MSCI SINGAPORE ETF,https://www.nyse.com/quote/ARCX:EWS
EWT,ISHARES INC MSCI TAIWAN ETF,https://www.nyse.com/quote/ARCX:EWT
EWU,ISHARES TRUST MSCI UTD KINGDOM ETF NEW,https://www.nyse.com/quote/ARCX:EWU
EWUS,ISHARES TRUST MSCI UNITED KINGDOM SMALL-CAP ETF,https://www.nyse.com/quote/BATS:EWUS
EWV,PROSHARES ULTRASHORT MSCI JAPAN,https://www.nyse.com/quote/ARCX:EWV
EWW,ISHARES INC MSCI MEXICO ETF,https://www.nyse.com/quote/ARCX:EWW
EWX,SPDR INDEX SHARES FUNDS S&P EMERGING MKTS SM CAP ETF,https://www.nyse.com/quote/ARCX:EWX
EWY,ISHARES INC MSCI SOUTH KOREA ETF,https://www.nyse.com/quote/ARCX:EWY
EWZ,ISHARES INC MSCI BRAZIL ETF,https://www.nyse.com/quote/ARCX:EWZ
EWZS,ISHARES TRUST MSCI BRAZIL SMALL-CAP ETF,https://www.nyse.com/quote/XNMS:EWZS
EXI,ISHARES TRUST GLOBAL INDUSTRIALS ETF,https://www.nyse.com/quote/ARCX:EXI
EXUS,NOMURA FOCUSED INTERNATIONAL CORE ETF,https://www.nyse.com/quote/XNMS:EXUS
EYEG,AB ACTIVE ETFS INC CORPORATE BOND ETF USD,https://www.nyse.com/quote/XNMS:EYEG
EYLD,CAMBRIA ETF TRUST EMERGING SHAREHOLDER YIELD ETF,https://www.nyse.com/quote/BATS:EYLD
EZA,ISHARES INC MSCI SOUTH AFRICA ETF,https://www.nyse.com/quote/ARCX:EZA
EZBC,FRANKLIN TEMPLETON DIGITAL HLDGS TR BITCOIN ETF SHS,https://www.nyse.com/quote/BATS:EZBC
EZET,FRANKLIN ETHEREUM ETF,https://www.nyse.com/quote/BATS:EZET
EZJ,PROSHARES TRUST ULTRA MSCI JAPAN,https://www.nyse.com/quote/ARCX:EZJ
EZM,WISDOMTREE TRUST US MIDCAP FUND,https://www.nyse.com/quote/ARCX:EZM
EZMO,ALPHADROID BROAD MARKETS MOMENTUM ETF,https://www.nyse.com/quote/XNMS:EZMO
EZPZ,FRANKLIN CRYPTO INDEX ETF,https://www.nyse.com/quote/BATS:EZPZ
EZRO,ALPHADROID DEFENSIVE SECTOR ROTATION ETF,https://www.nyse.com/quote/XNMS:EZRO
EZU,ISHARES INC MSCI EUROZONE ETF,https://www.nyse.com/quote/BATS:EZU
FAAR,FIRST TR EXCHANGE-TRADED FD VII ALTERNATIVE ABSOLUTE RETURN STRATEGY,https://www.nyse.com/quote/XNMS:FAAR
FAB,FIRST TR EXCH TRADED ALPHADEX FD SHS ISUD BY FIST TR EXCHNG TRDED ALPH FD,https://www.nyse.com/quote/XNMS:FAB
FAD,FIRST TR EXCH TRADED ALPHADEX FD SHS MULTI CAP GROWTH ALPHADEX FUND,https://www.nyse.com/quote/XNMS:FAD
FAI,FIRST TRUST BLOOMBERG ARTIFICIAL INTELLIGENCE ETF,https://www.nyse.com/quote/ARCX:FAI
FALN,ISHARES TRUST,https://www.nyse.com/quote/XNAS:FALN
FAN,FIRST TRUST EXCH TRADED FUND 2 GLOBAL WIND ENERGY ETF,https://www.nyse.com/quote/ARCX:FAN
FAPR,FIRST TR EXCHANGE TRADED FD VIII VEST US EQUITY BUFFER ETF APRIL,https://www.nyse.com/quote/BATS:FAPR
FARX,FRONTIER ASSET ABSOLUTE RETURN ETF,https://www.nyse.com/quote/ARCX:FARX
FAS,DIREXION SHARES ETF TRUST DAILY FINL BULL 3X SHS NEW,https://www.nyse.com/quote/ARCX:FAS
FAUG,FIRST TR EXCHANGE TRADED FD VIII VEST US EQUITY BUFFER ETF AUGUST,https://www.nyse.com/quote/BATS:FAUG
FAZ,DIREXION DAILY FINANCIAL BEAR 3X SHARES,https://www.nyse.com/quote/ARCX:FAZ
FB,PROSHARES S&P 500 DYNAMIC BUFFER ETF,https://www.nyse.com/quote/BATS:FB
FBCG,FIDELITY COVINGTON TRUST BLUE CHIP GROWTH ETF,https://www.nyse.com/quote/BATS:FBCG
FBCV,FIDELITY COVINGTON TRUST BLUE CHIP VALUE ETF,https://www.nyse.com/quote/BATS:FBCV
FBDC,FT CONFLUENCE BDC & SPECIALTY FINANCE INCOME ETF,https://www.nyse.com/quote/ARCX:FBDC
FBL,GRANITESHARES ETF TRUST 2X LONG META DAILY ETF,https://www.nyse.com/quote/XNMS:FBL
FBND,FIDELITY MERRIMACK STREET TRUST TOTAL BD ETF,https://www.nyse.com/quote/ARCX:FBND
FBOT,FIDELITY COVINGTON TRUST DISRUPTIVE AUTOMATION ETF USD,https://www.nyse.com/quote/XNMS:FBOT
FBT,FIRST TRUST EXCHANGE TRADED FUND NYSE ARCA BIOTECHNOLOGY INDEX FUND,https://www.nyse.com/quote/ARCX:FBT
FBTC,FIDELITY WISE ORIGIN BITCOIN FD SHARES OF BENEFICIAL INTEREST,https://www.nyse.com/quote/BATS:FBTC
FBUF,FIDELITY DYNAMIC BUFFERED EQUITY ETF,https://www.nyse.com/quote/BATS:FBUF
FBY,TIDAL TRUST II YIELDMAX META OPTION INCOME STRATEGY ETF,https://www.nyse.com/quote/ARCX:FBY
FBYY,GRANITESHARES YIELDBOOST META ETF,https://www.nyse.com/quote/XNMS:FBYY
FCA,FIRST TR EXCH TRADED ALPHADEX FD II CHINA ALPHADEX FD,https://www.nyse.com/quote/XNMS:FCA
FCAL,FIRST TR EXCHANGE-TRADED FD III CALIFORNIA MUNICIPAL HIGH INCOME ETF,https://www.nyse.com/quote/XNMS:FCAL
FCBD,FRONTIER ASSET CORE BOND ETF,https://www.nyse.com/quote/ARCX:FCBD
FCEF,FIRST TR EXCHANGE TRADED FD VIII FIRST TRUST INCOME OPPORTUNITY ETF,https://www.nyse.com/quote/XNMS:FCEF
FCFY,FIRST TRUST EXCHANGE TRADED FUND S&P 500 DIVERSIFIED FREE CASH FLOW ETF U,https://www.nyse.com/quote/ARCX:FCFY
FCG,FIRST TRUST EXCHANGE TRADED FUND NATURAL GAS ETF,https://www.nyse.com/quote/ARCX:FCG
FCLD,FIDELITY COVINGTON TRUST CLOUD COMPUTING ETF USD,https://www.nyse.com/quote/BATS:FCLD
FCOM,FIDELITY COVINGTON TRUST MSCI COMMUNICATION SERVICES INDEX ETF,https://www.nyse.com/quote/ARCX:FCOM
FCOR,FIDELITY MERRIMACK STREET TRUST CORPORATE BD ETF,https://www.nyse.com/quote/ARCX:FCOR
FCPI,FIDELITY COVINGTON TRUST STKS FOR INFLATION ETF,https://www.nyse.com/quote/BATS:FCPI
FCSH,FEDERATED HERMES ETF TRUST SHORT DURATION CORPORATE ETF,https://www.nyse.com/quote/ARCX:FCSH
FCTE,SMI 3FOURTEEN FULL-CYCLE TREND ETF,https://www.nyse.com/quote/XNMS:FCTE
FCTR,FIRST TRUST EXCHANGE TRADED FUND LUNT US FACTOR ROTATION ETF,https://www.nyse.com/quote/BATS:FCTR
FCUS,TIDAL TRUST II PINNACLE FOCUSED OPPORTUNITIES ETF,https://www.nyse.com/quote/ARCX:FCUS
FCVT,FIRST TR EXCHANGE TRADED FD IV SSI STRATEGIC CONV SECS ETF,https://www.nyse.com/quote/XNMS:FCVT
FDAT,TIDAL TRUST II TACTICAL ADVANTAGE ETF,https://www.nyse.com/quote/ARCX:FDAT
FDCF,FIDELITY COVINGTON TRUST DISRUPTIVE COMMUNICATIONS ETF USD,https://www.nyse.com/quote/XNMS:FDCF
FDD,FIRST TRUST STOXX EUROPEAN SELECT DIVIDEND INDEX FUND,https://www.nyse.com/quote/ARCX:FDD
FDEC,FIRST TR EXCHANGE TRADED FD VIII VEST US EQUITY BUFFER ETF DECEMBER,https://www.nyse.com/quote/BATS:FDEC
FDEM,FIDELITY COVINGTON TRUST EMERGING MARKETS MULTIFACTOR ETF,https://www.nyse.com/quote/BATS:FDEM
FDEV,FIDELITY COVINGTON TRUST INTERNATIONAL MULTIFACTOR ETF,https://www.nyse.com/quote/BATS:FDEV
FDFF,FIDELITY COVINGTON TRUST DISRUPTIVE FINANCE ETF USD,https://www.nyse.com/quote/XNMS:FDFF
FDG,AMERICAN CENTURY ETF TRUST FOCUSED DYNAMIC GROWTH ETF,https://www.nyse.com/quote/ARCX:FDG
FDHY,FIDELITY ENHANCED HIGH YIELD ETF,https://www.nyse.com/quote/ARCX:FDHY
FDIF,FIDELITY COVINGTON TRUST DISRUPTORS ETF USD,https://www.nyse.com/quote/XNMS:FDIF
FDIG,FIDELITY COVINGTON TRUST CRYPTO INDUSTRY AND DIGITAL PAYMENTS ETF,https://www.nyse.com/quote/XNMS:FDIG
FDIS,FIDELITY COVINGTON TRUST MSCI CONSUMER DISCRETIONARY,https://www.nyse.com/quote/ARCX:FDIS
FDIV,EA SERIES TRUST MARKETDESK FOCUSED U S DIVID ETF,https://www.nyse.com/quote/XNMS:FDIV
FDL,FIRST TRUST EXCHANGE TRADED FUND FUNDS,https://www.nyse.com/quote/ARCX:FDL
FDLO,FIDELITY COVINGTON TRUST LOW VOLATILITY FACTOR ETF,https://www.nyse.com/quote/ARCX:FDLO
FDLS,NORTHERN LIGHTS FUND TRUST IV INSPIRE FIDELIS MULTI FACTOR ETF,https://www.nyse.com/quote/ARCX:FDLS
FDM,FIRST TRUST EXCHANGE TRADED FUND FIRST TR DOW JONES SELECT MICROCAP INDEX,https://www.nyse.com/quote/ARCX:FDM
FDMO,FIDELITY COV TRS,https://www.nyse.com/quote/XNYS:FDMO
FDN,FIRST TRUST EXCHANGE TRADED FUND DOW JONES INTERNET INDEX USD DIS,https://www.nyse.com/quote/ARCX:FDN
FDND,FIRST TR EXCHANGE TRADED FD IV FT VEST DOW JONES INTERNET TARGT INCM E,https://www.nyse.com/quote/BATS:FDND
FDNI,FIRST TRUST EXCH TRADED FUND 2 DOW JONES INTERNATIONAL INTERNET ETF,https://www.nyse.com/quote/XNMS:FDNI
FDRR,FIDELITY COV TRS,https://www.nyse.com/quote/XNYS:FDRR
FDRS,FOUNDER-LED ETF,https://www.nyse.com/quote/XNMS:FDRS
FDRV,FIDELITY COVINGTON TRUST ELECTRIC VEHICLES & FUTURE TRANSPORTATIO,https://www.nyse.com/quote/BATS:FDRV
FDRX,FOUNDER-LED 2X DAILY ETF,https://www.nyse.com/quote/XNMS:FDRX
FDT,FIRST TR EXCH TRADED ALPHADEX FD II DEV MKTS EX US ALPHADEX FD,https://www.nyse.com/quote/XNMS:FDT
FDTS,FIRST TR EXCH TRADED ALPHADEX FD II DEV MKTS EX-US SMALL CAP ALPHADEX FD,https://www.nyse.com/quote/XNMS:FDTS
FDTX,FIDELITY COVINGTON TRUST DISRUPTIVE TECH ETF USD,https://www.nyse.com/quote/XNMS:FDTX
FDV,FEDERATED HERMES ETF TRUST US STRATEGIC DIVIDEND ETF,https://www.nyse.com/quote/ARCX:FDV
FDVV,FIDELITY COV TRS,https://www.nyse.com/quote/XNYS:FDVV
FEAC,FIDELITY ENHANCED U.S. ALL-CAP EQUITY ETF,https://www.nyse.com/quote/ARCX:FEAC
FEAT,YIELDMAX DORSEY WRIGHT FEATURED 5 INCOME ETF,https://www.nyse.com/quote/XNMS:FEAT
FEBM,FT VEST U.S. EQUITY MAX BUFFER ETF - FEBRUARY,https://www.nyse.com/quote/BATS:FEBM
FEBP,PGIM S&P 500 BUFFER 12 ETF - FEBRUARY,https://www.nyse.com/quote/BATS:FEBP
FEBT,ALLIANZIM U.S. EQUITY BUFFER10 FEB ETF,https://www.nyse.com/quote/BATS:FEBT
FEBU,ALLIANZIM U.S. EQUITY BUFFER15 UNCAPPED FEB ETF,https://www.nyse.com/quote/BATS:FEBU
FEBW,ALLIANZIM U.S. EQUITY BUFFER20 FEB ETF,https://www.nyse.com/quote/BATS:FEBW
FEBZ,LISTED FUND TRUST TRUESHARES STRUCTURED OUTCOME FEB ETF,https://www.nyse.com/quote/BATS:FEBZ
FEDM,FLEXSHARES TRUST ESG & CLIMATE DEV MKTS EX-US CORE IDX ET,https://www.nyse.com/quote/ARCX:FEDM
FEGE,FIRST EAGLE GLOBAL EQUITY ETF,https://www.nyse.com/quote/XNYS:FEGE
FEIG,FLEXSHARES TRUST ESG & CLIMATE INVT GRADE CORP CORE IDX E,https://www.nyse.com/quote/ARCX:FEIG
FELC,FIDELITY COVINGTON TRUST ENHANCED LARGE CAP CORE ETF,https://www.nyse.com/quote/ARCX:FELC
FELG,FIDELITY COVINGTON TRUST ENHANCED LARGE CAP GROWTH ETF,https://www.nyse.com/quote/ARCX:FELG
FELV,FIDELITY COVINGTON TRUST ENHANCED LARGE CAP VALUE ETF,https://www.nyse.com/quote/ARCX:FELV
FEM,FIRST TR EXCH TRADED ALPHADEX FD II EMERGING MKTS ALPHADEX FD,https://www.nyse.com/quote/XNMS:FEM
FEMB,FIRST TR EXCHANGE-TRADED FD III EMERGING MKT LOCAL CCY BD ETF,https://www.nyse.com/quote/XNMS:FEMB
FEMD,FIRST EAGLE MID CAP EQUITY ETF,https://www.nyse.com/quote/ARCX:FEMD
FEMR,FIDELITY ENHANCED EMERGING MARKETS ETF,https://www.nyse.com/quote/ARCX:FEMR
FEMS,FIRST TR EXCH TRADED ALPHADEX FD II EMERGING MARKETS SMALL CAP ALPHADEX FD,https://www.nyse.com/quote/XNMS:FEMS
FENI,FIDELITY COVINGTON TRUST ENHANCED INTERNATIONAL ETF,https://www.nyse.com/quote/ARCX:FENI
FENY,FIDELITY COVINGTON TRUST MSCI ENERGY INDEX ETF,https://www.nyse.com/quote/ARCX:FENY
FEOE,FIRST EAGLE OVERSEAS EQUITY ETF,https://www.nyse.com/quote/XNYS:FEOE
FEP,FIRST TR EXCH TRADED ALPHADEX FD II EUROPE ALPHADEX FD,https://www.nyse.com/quote/XNMS:FEP
FEPI,ETF OPPORTUNITIES TR REX FANG & INNVATN EQUITY PREMIUM INCOME,https://www.nyse.com/quote/XNMS:FEPI
FESM,FIDELITY COVINGTON TRUST ENHANCED SMALL CAP ETF,https://www.nyse.com/quote/ARCX:FESM
FETH,FIDELITY ETHEREUM FUND,https://www.nyse.com/quote/BATS:FETH
FEUS,FLEXSHARES TRUST ESG & CLIMATE US LARGE CAP CORE IDX ETF,https://www.nyse.com/quote/ARCX:FEUS
FEUZ,FIRST TR EXCH TRADED ALPHADEX FD II EUROZONE ALPHADEX,https://www.nyse.com/quote/XNMS:FEUZ
FEX,FIRST TR EXCH TRADED ALPHADEX FD COM SHS,https://www.nyse.com/quote/XNMS:FEX
FEZ,SPDR INDEX SHARES FUNDS EURO STOXX 50 ETF,https://www.nyse.com/quote/ARCX:FEZ
FFDI,FIDELITY FUNDAMENTAL DEVELOPED INTERNATIONAL ETF,https://www.nyse.com/quote/BATS:FFDI
FFEB,FIRST TR EXCHANGE TRADED FD VIII VEST US EQUITY BUFFER ETF FEB,https://www.nyse.com/quote/BATS:FFEB
FFEM,FIDELITY FUNDAMENTAL EMERGING MARKETS ETF,https://www.nyse.com/quote/BATS:FFEM
FFF,FOUNDERS 100 ETF,https://www.nyse.com/quote/BATS:FFF
FFGX,FIDELITY FUNDAMENTAL GLOBAL EX-U.S. ETF,https://www.nyse.com/quote/BATS:FFGX
FFIU,SPINNAKER ETF SERIES UVA UNCONSTRAINED MEDUM TRM FXD INCM ETF,https://www.nyse.com/quote/ARCX:FFIU
FFLC,FIDELITY COVINGTON TRUST FUNDAMENTAL LARGE CAP CORE ETF,https://www.nyse.com/quote/BATS:FFLC
FFLG,FIDELITY COVINGTON TRUST FUNDAMENTAL LARGE CAP GROWTH ETF,https://www.nyse.com/quote/BATS:FFLG
FFLS,NORTHERN LIGHTS FUND TRUST II THE FUTURE FUND LONG/SHORT ETF,https://www.nyse.com/quote/ARCX:FFLS
FFLV,FIDELITY COVINGTON TRUST FUNDAMENTAL LARGE CAP VALUE ETF,https://www.nyse.com/quote/BATS:FFLV
FFND,ONE GLOBAL ETF,https://www.nyse.com/quote/ARCX:FFND
FFOG,FRANKLIN TEMPLETON ETF TR FRANKLIN FOCUSED GROWTH ETF,https://www.nyse.com/quote/BATS:FFOG
FFOX,FUNDX FUTURE FUND OPPORTUNITIES ETF,https://www.nyse.com/quote/ARCX:FFOX
FFSM,FIDELITY COVINGTON TRUST FUNDAMENTAL SMALL MID CAP ETF,https://www.nyse.com/quote/BATS:FFSM
FFTY,INNOVATOR ETFS TRUST IBD 50 ETF,https://www.nyse.com/quote/ARCX:FFTY
FFUT,FIDELITY MANAGED FUTURES ETF,https://www.nyse.com/quote/XNMS:FFUT
FGD,FIRST TRUST EXCH TRADED FUND 2 FIRST TR DJ GBL SELECT DIVD,https://www.nyse.com/quote/ARCX:FGD
FGDL,FRANKLIN TEMPLETON HOLDINGS TRUST RESPONSIBLY SOURCED GOLD ETF,https://www.nyse.com/quote/ARCX:FGDL
FGM,FIRST TR EXCH TRADED ALPHADEX FD II GERMANY ALPHADEX FD,https://www.nyse.com/quote/XNMS:FGM
FGSI,FT VEST GROWTH STRENGTH & TARGET INCOME ETF,https://www.nyse.com/quote/XNMS:FGSI
FGSM,FRONTIER ASSET GLOBAL SMALL CAP EQUITY ETF,https://www.nyse.com/quote/ARCX:FGSM
FHDG,FT VEST U.S. EQUITY QUARTERLY DYNAMIC BUFFER ETF,https://www.nyse.com/quote/BATS:FHDG
FHEQ,FIDELITY HEDGED EQUITY ETF,https://www.nyse.com/quote/BATS:FHEQ
FHLC,FIDELITY COVINGTON TRUST MSCI HEALTH CARE INDEX ETF,https://www.nyse.com/quote/ARCX:FHLC
FHYS,FEDERATED HERMES ETF TRUST SHORT DURATION HIGH YIELD ETF,https://www.nyse.com/quote/ARCX:FHYS
FIAT,YIELDMAX SHORT COIN OPTION INCOME STRATEGY ETF,https://www.nyse.com/quote/ARCX:FIAT
FIAX,TIDAL TRUST II NICHOLAS FIXED INCOME ALTERNATIVE ETF,https://www.nyse.com/quote/ARCX:FIAX
FICS,FIRST TR EXCHANGE TRADED FD VI INTERNATIONAL DEV CAP STRENGTH ETF USD,https://www.nyse.com/quote/XNMS:FICS
FID,FIRST TR EXCHANGE TRADED FD VI S&P INTL DIVID ARISTOCRATS ETF,https://www.nyse.com/quote/XNMS:FID
FIDI,FIDELITY COVINGTON TRUST INTERNATIONAL HIGH DIVIDEND ETF,https://www.nyse.com/quote/ARCX:FIDI
FIDU,FIDELITY COVINGTON TRUST MSCI INDUSTRIALS INDEX,https://www.nyse.com/quote/ARCX:FIDU
FIGB,FIDELITY MERRIMACK STREET TRUST FIDELITY INVT GRADE BD ETF,https://www.nyse.com/quote/ARCX:FIGB
FIGG,LEVERAGE SHARES 2X LONG FIG DAILY ETF,https://www.nyse.com/quote/XNMS:FIGG
FIIG,FIRST TR EXCHANGE TRADED FD IV INTERMEDIATE DURATION INVESTMENT GRADE C,https://www.nyse.com/quote/ARCX:FIIG
FINT,FRONTIER ASSET TOTAL INTERNATIONAL EQUITY ETF,https://www.nyse.com/quote/ARCX:FINT
FINX,GLOBAL X FDS FINTECH ETF,https://www.nyse.com/quote/XNMS:FINX
FISR,STATE STREET FIXED INCOME SECTOR ROTATION ETF,https://www.nyse.com/quote/ARCX:FISR
FITE,STATE STREET SPDR S&P KENSHO FUTURE SECURITY ETF,https://www.nyse.com/quote/ARCX:FITE
FIVA,FIDELITY COVINGTON TRUST INTERNATIONAL VALUE FACTOR ETF,https://www.nyse.com/quote/ARCX:FIVA
FIVY,YIELDMAX DORSEY WRIGHT HYBRID 5 INCOME ETF,https://www.nyse.com/quote/XNMS:FIVY
