symbol,name,url
REKT,DIREXION DAILY CRYPTO INDUSTRY BEAR 1X SHARES,https://www.nyse.com/quote/ARCX:REKT
REM,ISHARES TRUST MORTGAGE REAL ESTATE ETF,https://www.nyse.com/quote/BATS:REM
REMC,COLUMBIA RESEARCH ENHANCED MID CAP ETF,https://www.nyse.com/quote/ARCX:REMC
REMG,RUSSELL INVESTMENTS EMERGING MARKETS EQUITY ETF,https://www.nyse.com/quote/XNMS:REMG
REMX,VANECK RARE EARTH AND STRATEGIC METALS ETF,https://www.nyse.com/quote/ARCX:REMX
RESM,COLUMBIA RESEARCH ENHANCED SMALL CAP ETF,https://www.nyse.com/quote/ARCX:RESM
RETL,DIREXION SHARES ETF TRUST DIRXON DLY RETAIL BULL 3X SHS (P/S,https://www.nyse.com/quote/ARCX:RETL
REVS,COLUMBIA ETF TR I RESEARCH ENHANCED VALUE ETF,https://www.nyse.com/quote/ARCX:REVS
REW,PROSHARES TRUST ULTRASHORT TECHNOLOGY (POST REV SPLIT),https://www.nyse.com/quote/ARCX:REW
REZ,ISHARES TRUST ISHARES RESIDENTIAL AND MULTISECTOR RL,https://www.nyse.com/quote/ARCX:REZ
RFCI,ALPS ETF TRUST RIVERFRONT DYNAMIC CORE INCOME ETF,https://www.nyse.com/quote/ARCX:RFCI
RFDA,ALPS ETF TRUST RIVERFRONT DYNAMIC US DIV ADVANTAGE ETF,https://www.nyse.com/quote/ARCX:RFDA
RFDI,FIRST TR EXCHANGE3,https://www.nyse.com/quote/XNYS:RFDI
RFEM,FIRST TR EXCHANGE3,https://www.nyse.com/quote/XNYS:RFEM
RFEU,FIRST TR EXCHANGE3,https://www.nyse.com/quote/XNYS:RFEU
RFFC,ALPS ETF TRUST,https://www.nyse.com/quote/XNYS:RFFC
RFG,INVESCO EXCHANGE TRADED FD TR S&P MIDCAP 400 PURE GROWTH ETF,https://www.nyse.com/quote/ARCX:RFG
RFIX,SIMPLIFY BOND BULL ETF,https://www.nyse.com/quote/ARCX:RFIX
RFLR,INNOVATOR U.S. SMALL CAP MANAGED FLOOR ETF,https://www.nyse.com/quote/ARCX:RFLR
RFV,INVESCO EXCHANGE TRADED FD TR S&P MIDCAP 400 PURE VALUE ETF,https://www.nyse.com/quote/ARCX:RFV
RGEF,ROCKEFELLER GLOBAL EQUITY ETF,https://www.nyse.com/quote/ARCX:RGEF
RGLO,RUSSELL INVESTMENTS GLOBAL EQUITY ETF,https://www.nyse.com/quote/XNMS:RGLO
RGTU,TRADR 2X LONG RGTI DAILY ETF,https://www.nyse.com/quote/BATS:RGTU
RGTX,DEFIANCE DAILY TARGET 2X LONG RGTI ETF,https://www.nyse.com/quote/XNMS:RGTX
RGTZ,DEFIANCE DAILY TARGET 2X SHORT RGTI ETF,https://www.nyse.com/quote/XNMS:RGTZ
RGYY,GRANITESHARES YIELDBOOST RGTI ETF,https://www.nyse.com/quote/XNMS:RGYY
RHRX,STARBOARD INVESTMENT TRUST RH TACTICAL ROTATION ETF,https://www.nyse.com/quote/ARCX:RHRX
RHTX,STARBOARD INVESTMENT TRUST RH TACTICAL OUTLOOK ETF,https://www.nyse.com/quote/ARCX:RHTX
RIET,ETF SERIES SOLUTIONS HOYA CAP HIGH DIVID YIELD ETF,https://www.nyse.com/quote/ARCX:RIET
RIFR,RUSSELL INVESTMENTS GLOBAL INFRASTRUCTURE ETF,https://www.nyse.com/quote/XNMS:RIFR
RIGS,ALPS ETF TRUST RIVERFRONT STRATEGIC INCOME FD,https://www.nyse.com/quote/ARCX:RIGS
RILA,INDEXPERTS GORILLA AGGRESSIVE GROWTH ETF,https://www.nyse.com/quote/ARCX:RILA
RINF,PROSHARES TRUST INFLATION EXPECTATIONS ETF,https://www.nyse.com/quote/ARCX:RINF
RING,ISHARES INC MSCI GLOBAL GOLD MINERS ETF,https://www.nyse.com/quote/XNMS:RING
RINT,RUSSELL INVESTMENTS INTERNATIONAL DEVELOPED EQUITY ETF,https://www.nyse.com/quote/XNMS:RINT
RIOX,DEFIANCE DAILY TARGET 2X LONG RIOT ETF,https://www.nyse.com/quote/ARCX:RIOX
RISN,INSPIRE CAPITAL APPRECIATION ETF,https://www.nyse.com/quote/ARCX:RISN
RISR,TIDAL ETF TRUST FOLIOBEYOND ALTR INM AND INT HEDGE ETF,https://www.nyse.com/quote/ARCX:RISR
RITA,ETF SERIES SOLUTIONS ETFB GREEN SRI REITS ETF,https://www.nyse.com/quote/ARCX:RITA
RJDI,RJ EAGLE GCM DIVIDEND SELECT INCOME ETF,https://www.nyse.com/quote/ARCX:RJDI
RJMI,RJ EAGLE MUNICIPAL INCOME ETF,https://www.nyse.com/quote/ARCX:RJMI
RJVI,RJ EAGLE VERTICAL INCOME ETF,https://www.nyse.com/quote/ARCX:RJVI
RKLX,DEFIANCE DAILY TARGET 2X LONG RKLB ETF,https://www.nyse.com/quote/XNMS:RKLX
RKLZ,DEFIANCE DAILY TARGET 2X SHORT RKLB ETF,https://www.nyse.com/quote/XNMS:RKLZ
RKNG,DEFIANCE RETAIL KINGS ETF,https://www.nyse.com/quote/XNMS:RKNG
RKTL,DEFIANCE DAILY TARGET 2X LONG RKT ETF,https://www.nyse.com/quote/BATS:RKTL
RLY,STATE STREET MULTI-ASSET REAL RETURN ETF,https://www.nyse.com/quote/ARCX:RLY
RMCA,ROCKEFELLER CALIFORNIA MUNICIPAL BOND ETF,https://www.nyse.com/quote/ARCX:RMCA
RMIF,ETF SERIES SOLUTIONS LHA RISK MANAGED INCOME ETF,https://www.nyse.com/quote/BATS:RMIF
RMME,RAREVIEW GOVERNMENT MONEY MARKET ETF,https://www.nyse.com/quote/BATS:RMME
RMNY,ROCKEFELLER NEW YORK MUNICIPAL BOND ETF,https://www.nyse.com/quote/ARCX:RMNY
RMOP,ROCKEFELLER OPPORTUNISTIC MUNICIPAL BOND ETF,https://www.nyse.com/quote/ARCX:RMOP
RND,FIRST TRUST BLOOMBERG R&D LEADERS ETF,https://www.nyse.com/quote/ARCX:RND
RNEM,FIRST TR EXCHANGE TRADED FD VI EMERGING MARKETS EQUITY SELECT ETF,https://www.nyse.com/quote/XNMS:RNEM
RNIN,BUSHIDO CAPITAL US SMID CAP EQUITY ETF,https://www.nyse.com/quote/XNMS:RNIN
RNRG,GLOBAL X FDS X RENEWABLE ENERGY PRODUCER,https://www.nyse.com/quote/XNMS:RNRG
RNTY,YIELDMAX TARGET 12 REAL ESTATE OPTION INCOME ETF,https://www.nyse.com/quote/ARCX:RNTY
RNWZ,TRUESHARES EAGLE GLOBAL RENEWABLE ENERGY INCOME ETF,https://www.nyse.com/quote/ARCX:RNWZ
ROAM,LATTICE STRATEGIES TR HARTFORD MULTIFACTOR EMERGING MARKTS ETF,https://www.nyse.com/quote/ARCX:ROAM
ROBN,T-REX 2X LONG HOOD DAILY TARGET ETF,https://www.nyse.com/quote/BATS:ROBN
ROBO,EXCHANGE TRADED CONCEPTS TRUST ROBO GLOBAL ROBOTICS & AUTO INDX ETF,https://www.nyse.com/quote/ARCX:ROBO
ROBT,FIRST TR EXCHANGE TRADED FD VI NASDAQ ARTIFICIAL INTELLIGENCE ROBO ETF,https://www.nyse.com/quote/XNMS:ROBT
RODM,LATTICE STRATEGIES TR HARTFORD MULTIFACTOR DEVELOPED MARKT ETF,https://www.nyse.com/quote/ARCX:RODM
ROE,EA SERIES TRUST ASTORIA US EQUAL WEIGHT QUALITY KINGS ETF,https://www.nyse.com/quote/XNMS:ROE
ROKT,STATE STREET SPDR S&P KENSHO FINAL FRONTIERS ETF,https://www.nyse.com/quote/ARCX:ROKT
ROM,PROSHARES TRUST PSHS ULTRA TECH,https://www.nyse.com/quote/ARCX:ROM
ROMO,STRATEGY SHARES NEWFOUND OR RESOLVE ROBUST MOMENTUM ETF,https://www.nyse.com/quote/BATS:ROMO
RONB,BARON FIRST PRINCIPLES ETF,https://www.nyse.com/quote/XNYS:RONB
ROPE,COASTAL COMPASS 100 ETF,https://www.nyse.com/quote/ARCX:ROPE
ROSC,LATTICE STRATEGIES TR HARTFORD MULTIFACTOR SMALL CAP ETF,https://www.nyse.com/quote/ARCX:ROSC
ROUS,LATTICE STRATEGIES TR HARTFORD MULTIFACTOR US EQUITY ETF,https://www.nyse.com/quote/ARCX:ROUS
RPAR,TIDAL ETF TRUST RPAR RISK PARITY ETF,https://www.nyse.com/quote/ARCX:RPAR
RPG,INVESCO EXCHANGE TRADED FD TR S&P 500 PURE GWTH ETF,https://www.nyse.com/quote/ARCX:RPG
RPHS,TWO RDS SHARED TRUST REGENTS PARK HEDGED MARKET STRATEGY ETF,https://www.nyse.com/quote/BATS:RPHS
RPV,INVESCO EXCHANGE TRADED FD TR S&P 500 PURE VALUE ETF,https://www.nyse.com/quote/ARCX:RPV
RSBA,RETURN STACKED BONDS & MERGER ARBITRAGE ETF,https://www.nyse.com/quote/BATS:RSBA
RSBT,TIDAL TRUST II RETURN STACKED BONDS & MANAGED FUTURES E,https://www.nyse.com/quote/BATS:RSBT
RSBY,RETURN STACKED BONDS & FUTURES YIELD ETF,https://www.nyse.com/quote/BATS:RSBY
RSDE,FT VEST U.S. EQUITY EQUAL WEIGHT BUFFER ETF - DECEMBER,https://www.nyse.com/quote/ARCX:RSDE
RSEE,COLLABORATIVE INVESTMNT SER TR RAREVIEW SYSTEMATIC EQUITY ETF,https://www.nyse.com/quote/BATS:RSEE
RSHO,TEMA ETF TRUST AMERICAN RESHORING ETF,https://www.nyse.com/quote/ARCX:RSHO
RSJN,FT VEST U.S. EQUITY EQUAL WEIGHT BUFFER ETF - JUNE,https://www.nyse.com/quote/ARCX:RSJN
RSMC,ROCKEFELLER U.S. SMALL-MID CAP ETF,https://www.nyse.com/quote/ARCX:RSMC
RSMR,FT VEST U.S. EQUITY EQUAL WEIGHT BUFFER ETF - MARCH,https://www.nyse.com/quote/ARCX:RSMR
RSMV,RELATIVE STRENGTH MANAGED VOLATILITY STRATEGY ETF,https://www.nyse.com/quote/ARCX:RSMV
RSP,INVESCO EXCHANGE TRADED FD TR S&P 500 EQUAL WEIGHT ETF,https://www.nyse.com/quote/ARCX:RSP
RSPA,INVESCO S&P 500 EQUAL WEIGHT INCOME ADVANTAGE ETF,https://www.nyse.com/quote/ARCX:RSPA
RSPC,INVESCO EXCHANGE TRADED FD TR S&P 500A EQL WGT COMMCATN SERVICE ETF,https://www.nyse.com/quote/ARCX:RSPC
RSPD,INVESCO EXCHANGE TRADED FD TR S&P 500 EQL WGT CONSUMER DISCRETION ETF,https://www.nyse.com/quote/ARCX:RSPD
RSPE,INVESCO EXCHANGE TRADED FD TR II ESG S&P 500 EQUAL WEIGHT ET,https://www.nyse.com/quote/ARCX:RSPE
RSPF,INVESCO EXCHANGE TRADED FD TR S&P 500 EQL WGT FINLS ETF,https://www.nyse.com/quote/ARCX:RSPF
RSPG,INVESCO EXCHANGE TRADED FD TR S&P 500 EQL WGT ENERGY ETF,https://www.nyse.com/quote/ARCX:RSPG
RSPH,INVESCO EXCHANGE TRADED FD TR S&P 500 EQL WGT HEALTHCARE ETF,https://www.nyse.com/quote/ARCX:RSPH
RSPM,INVESCO EXCHANGE TRADED FD TR S&P 500 EQL WGT MATLS ETF,https://www.nyse.com/quote/ARCX:RSPM
RSPN,INVESCO EXCHANGE TRADED FD TR S&P 500 EQL WGT INDLS ETF,https://www.nyse.com/quote/ARCX:RSPN
RSPR,INVESCO EXCHANGE TRADED FD TR S&P 500 EQL WGT REAL ESTATE ETF,https://www.nyse.com/quote/ARCX:RSPR
RSPS,INVESCO EXCHANGE TRADED FD TR S&P 500 EQL WGT CONSUMER STAPLES ETF,https://www.nyse.com/quote/ARCX:RSPS
RSPT,INVESCO EXCHANGE TRADED FD TR S&P 500 EQL WGT TECHNOLOGY ETF,https://www.nyse.com/quote/ARCX:RSPT
RSPU,INVESCO EXCHANGE TRADED FD TR S&P 500 EQL WGT UTILS ETF,https://www.nyse.com/quote/ARCX:RSPU
RSSB,TIDAL TRUST II RETURN STACKED GLOBAL STOCKS & BONDS ETF,https://www.nyse.com/quote/BATS:RSSB
RSSE,FT VEST U.S. EQUITY EQUAL-WEIGHT BUFFER ETF - SEPTEMBER,https://www.nyse.com/quote/ARCX:RSSE
RSSL,GLOBAL X RUSSELL 2000 ETF,https://www.nyse.com/quote/ARCX:RSSL
RSST,TIDAL TRUST II RETURN STCKD US STK MANGD FUTURES ETF,https://www.nyse.com/quote/BATS:RSST
RSSX,RETURN STACKED U.S. STOCKS & GOLD/BITCOIN ETF,https://www.nyse.com/quote/BATS:RSSX
RSSY,RETURN STACKED U.S. STOCKS & FUTURES YIELD ETF,https://www.nyse.com/quote/BATS:RSSY
RTAI,COLLABORATIVE INVESTMNT SER TR RAREVIEW TAX ADVANTAGED INCOME ETF,https://www.nyse.com/quote/BATS:RTAI
RTH,VANECK ETF TR RETAIL ETF,https://www.nyse.com/quote/XNMS:RTH
RTRE,RAREVIEW TOTAL RETURN BOND ETF,https://www.nyse.com/quote/BATS:RTRE
RTXG,LEVERAGE SHARES 2X LONG RTX DAILY ETF,https://www.nyse.com/quote/XNMS:RTXG
RTYY,GRANITESHARES YIELDBOOST RIOT ETF,https://www.nyse.com/quote/XNMS:RTYY
RULE,COLLABORATIVE INVESTMNT SER TR ADAPTIVE CORE ETF USD,https://www.nyse.com/quote/BATS:RULE
RUNN,STRATEGIC TRUST RUNNING OAK EFFICIENT GROWTH ETF,https://www.nyse.com/quote/XNMS:RUNN
RUSC,RUSSELL INVESTMENTS U.S. SMALL CAP EQUITY ETF,https://www.nyse.com/quote/XNMS:RUSC
RVER,ADVISOR MANAGED PORTFOLIOS TRENCHLESS FUND ETF,https://www.nyse.com/quote/ARCX:RVER
RVNL,GRANITESHARES 2X LONG RIVN DAILY ETF,https://www.nyse.com/quote/XNMS:RVNL
RVNU,DBX ETF TRUST XTRACKERS MUNI INFRASTR REVENUE BOND ETF,https://www.nyse.com/quote/ARCX:RVNU
RVRB,ADVISORS SERIES TRUST REVERB ETF,https://www.nyse.com/quote/BATS:RVRB
RW,RAINWATER EQUITY ETF,https://www.nyse.com/quote/ARCX:RW
RWEM,RAYLIANT WILSHIRE NXTGEN EMERGING MARKETS EQUITY ETF,https://www.nyse.com/quote/ARCX:RWEM
RWJ,INVESCO EXCHANGE TRADED FD TR II S&P SMALLCAP 600 REVENUE ETF,https://www.nyse.com/quote/ARCX:RWJ
RWK,INVESCO EXCHANGE TRADED FD TR II S&P MIDCAP 400 REVENUE ETF,https://www.nyse.com/quote/ARCX:RWK
RWL,INVESCO EXCHANGE TRADED FD TR II S&P 500 REVENUE ETF,https://www.nyse.com/quote/ARCX:RWL
RWLC,RAYLIANT WILSHIRE NXTGEN US LARGE CAP EQUITY ETF,https://www.nyse.com/quote/ARCX:RWLC
RWM,PROSHARES TRUST SHORT RUSSELL2000 (POST REV SPLIT),https://www.nyse.com/quote/ARCX:RWM
RWO,SPDR INDEX SHARES FUNDS DJ GLOBAL REAL ESTATE ETF,https://www.nyse.com/quote/ARCX:RWO
RWR,STATE STREET SPDR DOW JONES REIT ETF,https://www.nyse.com/quote/ARCX:RWR
RWX,SPDR INDEX SHARES FUNDS SPDR DJ INTL REAL ESTATE ETF,https://www.nyse.com/quote/ARCX:RWX
RXD,PROSHARES TRUST ULTRASHORT HEALTHCARE NEW APRIL 2021(R/S,https://www.nyse.com/quote/ARCX:RXD
RXI,ISHARES TRUST GLOBAL CONS DISC ETF,https://www.nyse.com/quote/ARCX:RXI
RXL,PROSHARES TRUST PSHS ULT HLTHCRE,https://www.nyse.com/quote/ARCX:RXL
RYLD,GLOBAL X FDS RUSSELL 2000 COVERED CALL ETF,https://www.nyse.com/quote/ARCX:RYLD
RYLG,GLOBAL X FDS RUSSELL 2000 COVERED CALL & GROWTH ETF,https://www.nyse.com/quote/ARCX:RYLG
RYSE,ETF SERIES SOLUTIONS VEST 10 YEAR INTEREST RATE HEDGE ETF,https://www.nyse.com/quote/BATS:RYSE
RZG,INVESCO EXCHANGE TRADED FD TR S&P SMALLCAP 600 PURE GROWTH ETF,https://www.nyse.com/quote/ARCX:RZG
RZV,INVESCO EXCHANGE TRADED FD TR S&P SMALLCAP 600 PURE VALUE ETF,https://www.nyse.com/quote/ARCX:RZV
SAA,PROSHARES TRUST PSHS ULT SCAP600,https://www.nyse.com/quote/ARCX:SAA
SAEF,SCHWAB ARIEL OPPORTUNITIES ETF,https://www.nyse.com/quote/ARCX:SAEF
SAGP,ADVISORS INNER CIRCLE FD III STRATEGAS GLOBAL POLICY OPPORTUNITIES ET,https://www.nyse.com/quote/ARCX:SAGP
SAMM,ADVISORS INNER CIRCLE FD III STRATEGAS MACRO MOMENTUM ETF,https://www.nyse.com/quote/ARCX:SAMM
SAMT,ADVISORS INNER CIRCLE FD III STRATEGAS MACRO THEMATIC OPPORTUNITIES E,https://www.nyse.com/quote/ARCX:SAMT
SAPH,SAP SE ADRHEDGED,https://www.nyse.com/quote/ARCX:SAPH
SARK,INVESTMENT MANAGERS SERIES TRUST II TRADR 1X SHORT INNOVATION DAILY ETF,https://www.nyse.com/quote/XNMS:SARK
SATG,LEVERAGE SHARES 2X LONG SATS DAILY ETF,https://www.nyse.com/quote/XNMS:SATG
SATO,INVESCO EXCHANGE TRADED FD TR II ALERIAN GALAXY CRYPTO ECON ETF USD,https://www.nyse.com/quote/BATS:SATO
SAUG,FIRST TR EXCHANGE TRADED FD VIII VEST US SMALL CAP MODERATE BUFFR ETF AUG,https://www.nyse.com/quote/BATS:SAUG
SAWG,AAM SAWGRASS US LARGE CAP QUALITY GROWTH ETF,https://www.nyse.com/quote/ARCX:SAWG
SAWS,AAM SAWGRASS US SMALL CAP QUALITY GROWTH ETF,https://www.nyse.com/quote/ARCX:SAWS
SBAR,SIMPLIFY BARRIER INCOME ETF,https://www.nyse.com/quote/ARCX:SBAR
SBB,PROSHARES TRUST PSHS SHT SCAP600,https://www.nyse.com/quote/ARCX:SBB
SBIL,SIMPLIFY GOVERNMENT MONEY MARKET ETF,https://www.nyse.com/quote/ARCX:SBIL
SBIO,ALPS ETF TRUST MEDICAL BREAKTHROUGHS ETF,https://www.nyse.com/quote/ARCX:SBIO
SBIT,PROSHARES ULTRASHORT BITCOIN ETF,https://www.nyse.com/quote/ARCX:SBIT
SBND,COLUMBIA ETF TR I SHORT DURATION BD ETF,https://www.nyse.com/quote/ARCX:SBND
SBTU,T-REX 2X LONG SBET DAILY TARGET ETF,https://www.nyse.com/quote/BATS:SBTU
SBU,LEVERAGE SHARES 2X LONG SBUX DAILY ETF,https://www.nyse.com/quote/XNMS:SBU
SCAP,SERIES PORTFOLIOS,https://www.nyse.com/quote/XNYS:SCAP
SCC,PROSHARES ULTRASHORT CONSUMER DISCRETIONARY,https://www.nyse.com/quote/ARCX:SCC
SCCR,SCHWAB CORE BOND ETF,https://www.nyse.com/quote/ARCX:SCCR
SCDS,JPMORGAN FUNDAMENTAL DATA SCIENCE SMALL CORE ETF,https://www.nyse.com/quote/XNMS:SCDS
SCDV,BAHL & GAYNOR SMALL CAP DIVIDEND ETF,https://www.nyse.com/quote/ARCX:SCDV
SCEC,STERLING CAPITAL ENHANCED CORE BOND ETF,https://www.nyse.com/quote/BATS:SCEC
SCEP,STERLING CAPITAL HEDGED EQUITY PREMIUM INCOME ETF,https://www.nyse.com/quote/BATS:SCEP
SCHA,SCHWAB STRATEGIC TR US SMALL-CAP ETF,https://www.nyse.com/quote/ARCX:SCHA
SCHB,SCHWAB STRATEGIC TR US BROAD MKT ETF,https://www.nyse.com/quote/ARCX:SCHB
SCHC,SCHWAB STRATEGIC TR INTL SMALL CAP EQUITY ETF,https://www.nyse.com/quote/ARCX:SCHC
SCHD,SCHWAB STRATEGIC TR US DIVIDEND EQUITY ETF,https://www.nyse.com/quote/ARCX:SCHD
SCHE,SCHWAB STRATEGIC TR EMERGING MKTS EQUITY ETF,https://www.nyse.com/quote/ARCX:SCHE
SCHF,SCHWAB STRATEGIC TR INTL EQUITY ETF,https://www.nyse.com/quote/ARCX:SCHF
SCHG,SCHWAB STRATEGIC TR US LARGE-CAP GROWTH ETF,https://www.nyse.com/quote/ARCX:SCHG
SCHH,SCHWAB STRATEGIC TR US REIT ETF,https://www.nyse.com/quote/ARCX:SCHH
SCHI,SCHWAB STRATEGIC TR 5-10 YEAR CORPORATE BOND ETF,https://www.nyse.com/quote/ARCX:SCHI
SCHJ,SCHWAB STRATEGIC TR 1-5 YEAR CORPORATE BOND ETF,https://www.nyse.com/quote/ARCX:SCHJ
SCHK,SCHWAB STRATEGIC TR 1000 INDEX ETF,https://www.nyse.com/quote/ARCX:SCHK
SCHM,SCHWAB STRATEGIC TR US MID-CAP ETF,https://www.nyse.com/quote/ARCX:SCHM
SCHO,SCHWAB STRATEGIC TR SHORT-TERM US TREASURY ETF,https://www.nyse.com/quote/ARCX:SCHO
SCHP,SCHWAB STRATEGIC TR US TIPS ETF,https://www.nyse.com/quote/ARCX:SCHP
SCHQ,SCHWAB STRATEGIC TR LONG TERM U S TREASURY ETF,https://www.nyse.com/quote/ARCX:SCHQ
SCHR,SCHWAB STRATEGIC TR INTERMEDIATE-TERM US TREASURY ETF,https://www.nyse.com/quote/ARCX:SCHR
SCHV,SCHWAB STRATEGIC TR US LARGE-CAP VALUE ETF,https://www.nyse.com/quote/ARCX:SCHV
SCHX,SCHWAB STRATEGIC TR US LARGE-CAP ETF,https://www.nyse.com/quote/ARCX:SCHX
SCHY,SCHWAB STRATEGIC TR INTERNATIONAL DIVIDEND EQUITY ETF,https://www.nyse.com/quote/ARCX:SCHY
SCHZ,SCHWAB STRATEGIC TR US AGGREGATE BD ETF,https://www.nyse.com/quote/ARCX:SCHZ
SCIO,FIRST TR EXCHANGE TRADED FD IV STRUCTURED CREDIT INCOME OPPORTUNITIES E,https://www.nyse.com/quote/ARCX:SCIO
SCJ,ISHARES INC MSCI JAPAN SMALL-CAP ETF,https://www.nyse.com/quote/ARCX:SCJ
SCLS,STONEPORT ADVISORS COMMODITY LONG SHORT ETF,https://www.nyse.com/quote/XNMS:SCLS
SCLZ,NORTHERN LIGHTS FUND TRUST III SWAN ENHANCED DIVIDEND INCOME ETF,https://www.nyse.com/quote/BATS:SCLZ
SCMB,SCHWAB STRATEGIC TR MUNICIPAL BOND ETF,https://www.nyse.com/quote/ARCX:SCMB
SCMC,STERLING CAPITAL MULTI-STRATEGY INCOME ETF,https://www.nyse.com/quote/BATS:SCMC
SCNM,STERLING CAPITAL NATIONAL MUNICIPAL BOND ETF,https://www.nyse.com/quote/BATS:SCNM
SCO,PROSHARES TRUST II ULTRASHORT BLOOMBERG CRUDE OIL(REV SPLIT,https://www.nyse.com/quote/ARCX:SCO
SCOW,PACER S&P SMALLCAP 600 QUALITY FCF ARISTOCRATS ETF,https://www.nyse.com/quote/BATS:SCOW
SCUS,SCHWAB ULTRA-SHORT INCOME ETF,https://www.nyse.com/quote/ARCX:SCUS
SCYB,SCHWAB STRATEGIC TR HIGH YIELD BOND ETF USD,https://www.nyse.com/quote/ARCX:SCYB
SCZ,ISHARES TRUST MSCI EAFE SMALL-CAP ETF,https://www.nyse.com/quote/XNMS:SCZ
SDCI,USCF ETF TRUST SUMERHAVN DYNMC COMDTY STRTGY NO K 1 FD,https://www.nyse.com/quote/ARCX:SDCI
SDCP,VIRTUS ETF TRUST II NEWFLEET SHORT DURATION CORE PLUS BOND,https://www.nyse.com/quote/ARCX:SDCP
SDD,PROSHARES TRUST ULTRASHORT SMALLCAP600 NEW APR 2021(R/S),https://www.nyse.com/quote/ARCX:SDD
SDEM,GLOBAL X FDS MSCI SUPERDIVIDEND EMERGING MRKTS (R/S),https://www.nyse.com/quote/ARCX:SDEM
SDFI,AB SHORT DURATION INCOME ETF,https://www.nyse.com/quote/ARCX:SDFI
SDG,ISHARES TRUST MSCI GBL SUSTAINABLE DEVELOPMENT GOAL,https://www.nyse.com/quote/XNMS:SDG
SDIV,GLOBAL X FDS SUPERDIVIDEND ETF(POST REV SPLT),https://www.nyse.com/quote/ARCX:SDIV
SDOG,ALPS ETF TRUST SECTOR DIVIDEND DOGS ETF,https://www.nyse.com/quote/ARCX:SDOG
SDOW,PROSHARES ULTRAPRO SHORT DOW30,https://www.nyse.com/quote/ARCX:SDOW
SDP,PROSHARES ULTRASHORT UTILITIES,https://www.nyse.com/quote/ARCX:SDP
SDS,PROSHARES TRUST ULTRASHORT S&P 500 (POST REV SPLIT),https://www.nyse.com/quote/ARCX:SDS
SDSI,AMERICAN CENTURY ETF TRUST SHORT DURATION STRATEGIC INCOME ETF,https://www.nyse.com/quote/XNMS:SDSI
SDTY,YIELDMAX S&P 500 0DTE COVERED CALL STRATEGY ETF,https://www.nyse.com/quote/XNMS:SDTY
SDVD,FIRST TR EXCHANGE TRADED FD IV VEST SMID RISING DIVIDEND ACHIVR TRG INC,https://www.nyse.com/quote/BATS:SDVD
SDVY,FIRST TR EXCHANGE TRADED FD VI SMID CAP RISING DIVIDEND ACHIEVERS ETF,https://www.nyse.com/quote/XNMS:SDVY
SDY,STATE STREET SPDR S&P DIVIDEND ETF,https://www.nyse.com/quote/ARCX:SDY
SEA,ETF SERIES SOLUTIONS US GLOBAL SEA TO SKY CARGO ETF,https://www.nyse.com/quote/ARCX:SEA
SECR,NYLI MACKAY SECURITIZED INCOME ETF,https://www.nyse.com/quote/ARCX:SECR
SECT,NORTHERN LIGHTS FUND TRUST IV MAIN SECTOR ROTATION ETF,https://www.nyse.com/quote/BATS:SECT
SECU,ISHARES SECURITIZED INCOME ACTIVE ETF,https://www.nyse.com/quote/BATS:SECU
SEEM,SEI SELECT EMERGING MARKETS EQUITY ETF,https://www.nyse.com/quote/XNMS:SEEM
SEF,PROSHARES SHORT FINANCIALS,https://www.nyse.com/quote/ARCX:SEF
SEIE,SEI SELECT INTERNATIONAL EQUITY ETF,https://www.nyse.com/quote/XNMS:SEIE
SEIM,SEI EXCHANGE TRADED FUNDS ENHANCED US LARGECAP MOMENTUM FACTOR ETF,https://www.nyse.com/quote/BATS:SEIM
SEIQ,SEI EXCHANGE TRADED FUNDS ENHANCED US LARGE CAP QUALITY FACTOR ETF,https://www.nyse.com/quote/BATS:SEIQ
SEIS,SEI SELECT SMALL CAP ETF,https://www.nyse.com/quote/XNMS:SEIS
SEIV,SEI EXCHANGE TRADED FUNDS ENHANCED U S LARGE CAP VALUE FACTOR ETF,https://www.nyse.com/quote/BATS:SEIV
SEIX,VIRTUS ETF TRUST II VIRTUS SEIX SENIOR LOAN ETF,https://www.nyse.com/quote/ARCX:SEIX
SELV,SEI EXCHANGE TRADED FUNDS ENHANCED LOW VOLATILITY US LARGE CAP ETF,https://www.nyse.com/quote/BATS:SELV
SEMG,SUNCOAST SELECT GROWTH ETF,https://www.nyse.com/quote/ARCX:SEMG
SEMI,COLUMBIA SELECT TECHNOLOGY ETF,https://www.nyse.com/quote/ARCX:SEMI
SEMY,GRANITESHARES YIELDBOOST SEMICONDUCTOR ETF,https://www.nyse.com/quote/XNMS:SEMY
SEPI,SHELTON EQUITY PREMIUM INCOME ETF,https://www.nyse.com/quote/ARCX:SEPI
SEPM,FT VEST U.S. EQUITY MAX BUFFER ETF - SEPTEMBER,https://www.nyse.com/quote/BATS:SEPM
SEPP,PGIM S&P 500 BUFFER 12 ETF - SEPTEMBER,https://www.nyse.com/quote/BATS:SEPP
SEPT,ALLIANZIM U.S. EQUITY BUFFER10 SEP ETF,https://www.nyse.com/quote/BATS:SEPT
SEPU,ALLIANZIM U.S. EQUITY BUFFER15 UNCAPPED SEP ETF,https://www.nyse.com/quote/BATS:SEPU
SEPW,ALLIANZIM U.S. EQUITY BUFFER20 SEP ETF,https://www.nyse.com/quote/BATS:SEPW
SEPZ,LISTED FUND TRUST TRUESHARES STRUCTURED OUTCOME SEP ETF,https://www.nyse.com/quote/BATS:SEPZ
SETH,PROSHARES SHORT ETHER ETF,https://www.nyse.com/quote/ARCX:SETH
SETM,SPROTT FUNDS TRUST SPROTT CRITICAL MATERIALS ETF,https://www.nyse.com/quote/XNMS:SETM
SFEB,FIRST TR EXCHANGE TRADED FD VIII FT VEST US SMALL CAP MODE BUF ETF FEB,https://www.nyse.com/quote/BATS:SFEB
SFGV,SEQUOIA GLOBAL VALUE ETF,https://www.nyse.com/quote/ARCX:SFGV
SFLO,VICTORY PORTFOLIOS II VICTORYSHARES SMALL CAP FREE CASH FLOW,https://www.nyse.com/quote/XNMS:SFLO
SFLR,INNOVATOR ETFS TRUST EQUITY MANAGED FLOOR ETF,https://www.nyse.com/quote/ARCX:SFLR
SFTX,HORIZON INTERNATIONAL MANAGED RISK ETF,https://www.nyse.com/quote/ARCX:SFTX
SFTY,HORIZON MANAGED RISK ETF,https://www.nyse.com/quote/BATS:SFTY
SFY,SOFI SELECT 500 ETF,https://www.nyse.com/quote/ARCX:SFY
SFYF,TIDAL ETF TRUST SOFI SOCIAL 50 ETF,https://www.nyse.com/quote/ARCX:SFYF
SFYX,TIDAL TRUST I SOFI NEXT 500 ETF,https://www.nyse.com/quote/ARCX:SFYX
SGDJ,SPROTT ETF TR JUNIOR GOLD MINERS ETF,https://www.nyse.com/quote/ARCX:SGDJ
SGDM,SPROTT ETF TR GOLD MINERS ETF,https://www.nyse.com/quote/ARCX:SGDM
SGLC,RBB FUND INC SGI US LARGE CAP CORE ETF,https://www.nyse.com/quote/ARCX:SGLC
SGOL,ABRDN GOLD ETF TR ABRDN PHYSICAL GOLD SHARES ETF,https://www.nyse.com/quote/ARCX:SGOL
SGOV,ISHARES TRUST ISHARES 0-3 MONTH TREASURY BOND ETF,https://www.nyse.com/quote/ARCX:SGOV
SGRT,SMART EARNINGS GROWTH 30 ETF,https://www.nyse.com/quote/ARCX:SGRT
SGRW,HARBOR ACTIVE SMALL CAP GROWTH ETF,https://www.nyse.com/quote/ARCX:SGRW
SGVT,SCHWAB GOVERNMENT MONEY MARKET ETF,https://www.nyse.com/quote/ARCX:SGVT
SH,PROSHARES SHORT S&P 500,https://www.nyse.com/quote/ARCX:SH
SHAG,WISDOMTREE TRUST YIELD ENHANCED U S SHORT TERM AGGREGATE,https://www.nyse.com/quote/BATS:SHAG
SHDG,ADVISOR MANAGED PORTFOLIOS SOUNDWATCH HEDGED EQUITY ETF,https://www.nyse.com/quote/BATS:SHDG
SHE,SPDR SERIES TRUST,https://www.nyse.com/quote/XNYS:SHE
SHEH,SHELL PLC ADRHEDGED,https://www.nyse.com/quote/ARCX:SHEH
SHLD,GLOBAL X FDS DEFENSE TECH ETF,https://www.nyse.com/quote/ARCX:SHLD
SHM,STATE STREET SPDR NUVEEN ICE SHORT TERM MUNICIPAL BOND ETF,https://www.nyse.com/quote/ARCX:SHM
SHNY,BANK OF MONTREAL,https://www.nyse.com/quote/XNYS:SHNY
SHOC,EA SERIES TRUST STRIVE US SEMICONDUCTOR ETF,https://www.nyse.com/quote/XNYS:SHOC
SHPD,DIREXION DAILY SHOP BEAR 1X ETF,https://www.nyse.com/quote/XNMS:SHPD
SHPP,PACER FDS TR INDUSTRIALS AND LOGISTICS ETF,https://www.nyse.com/quote/ARCX:SHPP
SHPU,DIREXION DAILY SHOP BULL 2X ETF,https://www.nyse.com/quote/XNMS:SHPU
SHRT,TIDAL ETF TRUST GOTHAM SHORT STRATEGIES ETF,https://www.nyse.com/quote/ARCX:SHRT
SHRY,FIRST TR EXCHANGE TRADED FD VI FIRST TRUT BLOOMBRG SHRHOLDR YILD ETF,https://www.nyse.com/quote/XNMS:SHRY
SHUS,STRATIFIED LARGECAP HEDGED ETF,https://www.nyse.com/quote/ARCX:SHUS
SHV,ISHARES TRUST TRUST ISHARES 0-1 YEAR TREASURY BOND ETF,https://www.nyse.com/quote/XNMS:SHV
SHY,ISHARES TRUST 1-3 YEAR TREASURY BOND ETF,https://www.nyse.com/quote/XNMS:SHY
SHYD,VANECK ETF TR VANECK SHORT HIGH YIELD MUN,https://www.nyse.com/quote/BATS:SHYD
SHYG,ISHARES TRUST 0-5YR HIGH YEILD CORP BD ETF,https://www.nyse.com/quote/ARCX:SHYG
SHYL,DBX ETF TRUST XTRACKERS SHRT DURATION HIG YLD BOND ETF,https://www.nyse.com/quote/ARCX:SHYL
SHYM,ISHARES SHORT DURATION HIGH YIELD MUNI ACTIVE ETF,https://www.nyse.com/quote/BATS:SHYM
SIFI,HARBOR ETF TRUST HARBOR SCIENTIFIC ALPHA INC,https://www.nyse.com/quote/ARCX:SIFI
SIHY,HARBOR ETF TRUST HARBOR SCIENTIFIC ALPHA HIGH YIELD ETF,https://www.nyse.com/quote/ARCX:SIHY
SIJ,PROSHARES ULTRASHORT INDUSTRIALS,https://www.nyse.com/quote/ARCX:SIJ
SIL,GLOBAL X FDS GLOBAL X SILVER MINERS ETF (POST REV SPL,https://www.nyse.com/quote/ARCX:SIL
SILJ,AMPLIFY ETF TRUST JUNIOR SILVER MINERS ETF,https://www.nyse.com/quote/ARCX:SILJ
SIMS,STATE STREET SPDR S&P KENSHO INTELLIGENT STRUCTURES ETF,https://www.nyse.com/quote/ARCX:SIMS
SIO,TOUCHSTONE STRATEGIC INCOME ETF,https://www.nyse.com/quote/ARCX:SIO
SIOO,VISTASHARES TARGET 15 S&P 100 DISTRIBUTION ETF,https://www.nyse.com/quote/ARCX:SIOO
SIVR,ABRDN SILVER ETF TR ABRDN PHYSICAL SILVER SHARES ETF,https://www.nyse.com/quote/ARCX:SIVR
SIXA,EXCHANGE TRADED CONCEPTS TRUST ETC 6 MERIDIAN MEGA CAP EQUITY ETF,https://www.nyse.com/quote/ARCX:SIXA
SIXD,ALLIANZIM U.S. EQUITY 6 MONTH BUFFER10 JUN/DEC ETF,https://www.nyse.com/quote/BATS:SIXD
SIXF,ALLIANZIM U.S. EQUITY 6 MONTH BUFFER10 FEB/AUG ETF,https://www.nyse.com/quote/BATS:SIXF
SIXG,DEFIANCE CONNECTIVE TECHNOLOGIES ETF,https://www.nyse.com/quote/XNMS:SIXG
SIXH,EXCHANGE TRADED CONCEPTS TRUST ETC 6 MERIDIAN HEDGED EQUITY INDEX OPTIO,https://www.nyse.com/quote/ARCX:SIXH
SIXJ,ALLIANZIM U.S. EQUITY 6 MONTH BUFFER10 JAN/JUL ETF,https://www.nyse.com/quote/BATS:SIXJ
SIXL,EXCHANGE TRADED CONCEPTS TRUST ECF 6 MERIDIAN LOW BETA EQTY STRATGY ETF,https://www.nyse.com/quote/ARCX:SIXL
SIXO,ALLIANZIM U.S. EQUITY 6 MONTH BUFFER10 APR/OCT ETF,https://www.nyse.com/quote/BATS:SIXO
SIXP,ALLIANZIM U.S. EQUITY 6 MONTH BUFFER10 MAR/SEP ETF,https://www.nyse.com/quote/BATS:SIXP
SIXS,EXCHANGE TRADED CONCEPTS TRUST ETC 6 MERIDIAN SMALL CAP EQUITY ETF,https://www.nyse.com/quote/ARCX:SIXS
SIXZ,ALLIANZIM U.S. EQUITY 6 MONTH BUFFER10 MAY/NOV ETF,https://www.nyse.com/quote/BATS:SIXZ
SIZE,ISHARES TRUST MSCI USA SIZE FACTOR ETF,https://www.nyse.com/quote/ARCX:SIZE
SJB,PROSHARES TRUST SHORT HIGH YIELD,https://www.nyse.com/quote/ARCX:SJB
SJCP,SANJAC ALPHA CORE PLUS BOND ETF,https://www.nyse.com/quote/XNMS:SJCP
SJLD,SANJAC ALPHA LOW DURATION ETF,https://www.nyse.com/quote/XNMS:SJLD
SJNK,STATE STREET SPDR BLOOMBERG SHORT TERM HIGH YIELD BOND ETF,https://www.nyse.com/quote/ARCX:SJNK
